label,text
en,Fit well and don't ride up. Funky name but comfortable and unnoticeable which is what I want.
en,"Item is perfect, but i returned it. It was a gift and the person already had it. But the item is great."
el,Μετά από εννέα λεπτά ακούστηκε μια φωνή μέσα σε ένα τριχοειδή σκάφος :
el,"Ανάμεσα στις φανταστικές λεπτομέρειες των σκηνών της Νέας Διαθήκης , παρατήρησε ότι ο καταραμένος φαγώθηκε ζωντανός στην τελευταία κρίση ."
vi,Cô ấy chỉ ra rằng ngay cả các chương trình liên tục đã được kiểm tra lại và bắt buộc phải làm thay đổi giao thức .
vi,"Richard Brown đã bình luận về chi phí hàng đầu cao để phát triển công nghệ có nghĩa là phân phối những dịch vụ này , chẳng hạn như một buổi chiếu máy tính dựa trên máy tính ."
ar,"انا اقول و اجعل الامر واضحا : اذا قمت بعمل ثابت من تبادل اللكمات مع شرطي او مع اي شخص اخر لانك تاخذ كراهية الى وجهه , الطريقة التي تلتصق بها اذنيه , كيف يمشي او يتكلم , او ما هو اللون المعطف الذي كان يرتديه في الحرب , ثم يمكنك ان رول سريرك و جولة كلما كان افضل كلما كان افضل ."
ar,والقوانين الحكومية والمحلية بقدر ما تكون هذه الدولة والقوانين المحلية غير متسقة مع القواعد تفي بهذه المعايير .
nl,Het meisje rijdt op het paard.
nl,Een vrouw schilt een appel.
bg,"по-бързо , котенца !"
bg,фатален пътен инцидент в ивицата газа през декември 1987 г. бе последван от палестинската интифада ( въстание ) срещу израелските войски в окупираните територии .
pl,Czarno-biały pies biegnie przez pole krów.
pl,Sprzedaż chipów AMD wzrosła o 7 procent rok do roku do 402 milionów dolarów.
es,"El manillar por dentro venía defectuoso. La rosca interna estaba lisa y no sujetaba el tubo de la rueda delantera, por lo que no se podía dirigir."
es,No vale para nada se despega todo el rato
pt,"49 mortos, 148 feridos em ataques violentos no Iraque"
pt,BlackBerry perde 965 milhões de dólares no segundo trimestre
zh,特意为了三角螺丝刀买的，结果打滑拧不动，送过来是第三方快递，退货也要自己快递寄回去，虽然会返邮费。 记住：供应商直送的不是亚马逊自营，虽然写着由亚马逊直接销售和发货！
zh,买来感觉不错，用段时间就跑到一起去了，很多地方都空了！
hi,"लेकिन 1997 से 1996 . में संदेह करने का एक और कारण है , आईबीएम / mci प ् रोग ् राम ने 1988 से 1996.-500 पादसूचना दर ् ज की ."
hi,"कल की शक ् तिशाली टांगों ने ' दान ' के दृश ् य के सामने कदम रखा और देख रहा था , उसने कल एक तलवार झूला और अपने क ् लब को आदमी के पक ् ष में तोड ़ दिया ."
sw,"Hatimaye mwaka jana tu , nyumba ya mwisho ya mwisho alikuwa na nyumba ya nyumbani alikuwa nayo kwa hiyo eneo sasa imejaa lakini tuko katika jamii ya watu elfu tano"
sw,"Naam , nina imani yangu katika akhera na naamini kuwa , mungu will ."
ru,"Нападения могут серьезно подорвать операции , связанные с использованием компьютеров , подорвать конфиденциальность чувствительной информации и снизить целостность критических данных ."
ru,"Естественная рождаемость была усилена самыми передовыми системами ирригации Европы , которые все еще действуют в в каналах , которые вы увидите на пути к югу от павии ."
tr,"Bu , bu gibi davranışlar , iş arkadaşlarının , kadın ofis çalışanlarını çay servisi yapmaya veya işyerini temizlemek için zorla seks yapmaya aralıkları aralıkları ."
tr,"' ya da ... Abraham Ya da ... Her neyse ... Gerçekten beni öldürecek misin yoksa tutuklayacak mısın ? Çünkü değilse , bu konuşma benim zevkim için biraz varoluşçu olmaya başladı . ' '"
ja,ハンドガンのレールに付けた場合、右手グリップ時にサポートハンドの親指ではoffしかできず、右手のトリガーフィンガーでonとなるので夜戦時に普段off状態で移動して動くものを見つけてサポートハンドでスイッチon→即時発砲の流れが難しい。スイッチ方向が逆なら使いやすかったと思う。残念（左利きで普段左手で保持するなら逆に好都合です）。
ja,…… クリスマスプレゼントにと思い購入しました。 品物はきっといい物だと信じていますが… ダンボールに直接品物の絵が描かれた物が届きました。 結果、プレゼントする相手に悟られてしまったようです。。 この時期に、このダンボールで、正直腹わたが煮えくりかえりそうな気分ですが、100%とはいかなくとも、いいクリスマスになればと努力したいと思います。 これから購入される方で、もし同じシチュエーションの方がいらっしゃれば、気をつけて購入することをおすすめします。 ダンボールで中身が丸分かりです。 非常に悔しいです。
de,Für meine mäuse ist das nichts die können durch das Gitter
de,Für den unschlagbaren Preis einfach toll
fr,Je pensais qu'il y aurai t plus de maintien Une dorsale plus épaisse
fr,"C’est sympa , bien emballé, relativement. Facile à monter mais la notice est par contre mail faite je trouve . Attention je pensais que le nuage était plus grand en dimensions . En fait c’esr Assez petit"
ur,وولف نے پیسے اور صورتحال کے ساتھ پیسہ جمع کیا ، لیکن اس وقت کے سب سے زیادہ عرصہ تک ان کی مرضی کے مطابق نہیں ، شفاف اور غیر منافع بخش ۔
ur,انہوں نے مجھے بتایا ہے کہ میں نے سنا ہے کہ میں نے سنا ہے
it,Primo piano di una pecora bianca con la testa nera.
it,Così ho letto l'OP e indovinate cosa ho scoperto.
th,ดังนั้น การ วาง ของ ชิ้น สุดท้าย ของ ชิ้นส่วน สุดท้าย ของ รู ส เวล ท ์ และ ท รู แมน ดีไซน์ สำหรับ โลก ฟรี   --   ชิ้น ที่ พวกเขา ได้ พยายาม และ ล้มเหลว ที่จะ ใส่ ใน สถานที่ ใน วัน ของ พวกเขา   --   จะ เป็น ความสำเร็จ ที่ ต้อง ภูมิใจ
th,เข้ากันได้ เพื่อ แสดง ฟังก์ชัน ที่ จำเป็น ของ พวกเขา ขณะ แชร์ ฮาร์ดแวร์ หรือ สภาพแวดล้อม ซอฟต์แวร์ เดียวกัน
