label,text
it,"La polizia di Pechino ha arrestato più di 20 persone, tra cui 8 stranieri sospettati di usare e trafficare droga in 2 pub in un popolare centro della città."
it,I governi indiano e pakistano si sono quasi impegnati in un quarto conflitto nel 1999.
it,Chapman non è stato immediatamente arrestato e dovrebbe comparire per l'accusa il 3 luglio.
it,Militare: Le scorte di prodotti chimici siriani minacciano Israele
it,"Tuttavia, le entrate derivanti dai premi supplementari non sarebbero enormi."
it,Un trenino sta colpendo una macchinina.
it,L'iraniano Rouhani mette in guardia contro la talebanizzazione in Siria
it,Essere in una gang non è un crimine.
sw,"Kanuni zote za mwisho walikuwa na sec ya sec kulingana na mamlaka ya sehemu 5 , 7 , 8 , 10 , na 19 ( a ) ya tendo la usalama ( 15 u.s.c. )"
sw,"Hata hivyo , sehemu ya 330 ya kitendo cha usitafute kwa ufanisi marufuku issuance kwa kiwango chochote cha mgahawa hiyo na viwango vya kusoma. uwiiii .. kabla ya kupitishwa ya sehemu hii ."
sw,See i can talk you in that most wanawake wengi
sw,Sure ni na i think hapa ti sisi sisi ni tisa ama kumi
sw,"Wakati she , bi vandemeyer bado mnaona bila vuguvugu ."
sw,"Kisasa na ufanisi , mji mkuu wa karis ni njia rahisi ya kwa ya magharibi ya peninsula ."
sw,Uncle ' daan ' s uncle alionekana miaka kumi tangu juzi .
sw,I can ' t know that i ' m the only one but i ' m the only one but i ' m the only one but i ' m the only one but i ' m the only one but i ' m the only one but i ' m the only one to hiyo ni kama
zh,很好，很好，正品，内容很适合我，考研用书
zh,以前从不去评价，不知道浪费了多少积分，现在知道积分可以换钱，就要好好评价了，后来我就把这段话复制走了，既能赚积分，还省事，走到哪复制到哪，最重要的是，不用认真的评论了，不用想还差多少字，直接发出就可以了，推荐给大家
zh,东西收到了，就是不给开发票，发了邮件也没反应，客服电话要不就是不接，要不直接就断了，这么大一个书店就是想逃税吗?我要发票是用来报销的
zh,我的手环不能记步和测睡眠了，怎么弄？可以退货换货吗
zh,我定的单还要等几天能到，深圳到广州都两三天了还没到吗？
zh,总体而言不值，品质与价格不相称。虽然笔的设计很有创意，做工尚过得去，但是：书写不流畅，书写过程中稀里哗啦响，切换按钮很费劲，笔芯贵使用成本太高。
zh,简单说一下，首先已经收到货了，仔细看了一会，又用清水试了试是否褪色，综合以上所有，只能认定这绝对是条地摊货，好吧，不说多了，买者可以放心买，毕竟九十多，挺便宜的。
zh,这个是一个密封的塑料袋儿，袋子还是挺大的，里面应该是能装进去苹果plus，有挂绳和臂带。
de,"Lieferung kam schnell, das Anbringen der Folie verlief reibungslos. Ich kann leider nur wenig Gutes über diese Folie schreiben. An den Rändern erkennt man Farbübergänge. Mit der Zeit (habe die Folie seit 5 Monaten) entstehen Blasen, die im Nachhinein Einen stören. Gestern Abend fiel mein Smartphone aus 20 cm Höhe auf den Teppich und schon habe ich 3 Einbrüche an verschiedenen Stellen des Panzerglases. Außerdem könnte es an den Kanten ein paar Millimeter größer sein um somit das gesamte Display zu beschützen. Schade eigentlich. Somit kann ich dieses Produkt nicht weiterempfehlen."
de,"Alles an diesem Artikel super verarbeitet, tut was es soll."
de,Der Tragegurt war nur an einer Seite befestigt und Schrauben zum befestigen waren nicht dabei. Wenn ich Pappe für 16 Euro kaufe erwarte ich das sowas nicht passiert!!
de,Die erste Gerät war defekt und der zweite gerät war in Ordnung.
de,"Durch die guten Bewertungen bestellte ich sie, doch sie kamen bei mir nie an. Sehr schade!"
de,Weihnachtsgeschenk an alle... selten so herzlich gelacht. Das war der Brüller. Kann ich nur wärmstens empfehlen und auf jeden Fall lustige Familienfotos garantiert!!!
de,Es war zwar preiswert.....aber er sieht auch total billig aus.....
de,"Sehr schnelle ENTLadung, schnelle Ladung. Akku immer nach Herstellerangaben verwendet, trotzdem nach sehr kurzer Gebrauchszeit nahezu nichtmehr zu gebrauchen... Da ich den Aufwand für das zurückschicken momentan nicht aufwenden kann, bleibt es verschwendetes Geld.. sehr Schade..."
pt,Dois cães num canil vedado olham para a frente.
pt,Um gato está a lamber-se a si próprio.
pt,As acções da Guidant caíram no comércio tanto dentro como fora da Bolsa de Nova Iorque antes de ser imposta uma paragem da notícia após o meio-dia.
pt,Um homem está a olhar para um monitor de computador.
pt,O sindicato ainda não tinha revelado qual a cadeia que seria visada.
pt,Uma mulher com uma faca está a cortar uma pimenta.
pt,Dois cães a lutar na neve.
pt,Um homem está a tocar guitarra.
ar,ودعا الى البحث عن الحواجز التي يواجهها الاطباء في حالات الطوارئ في الحصول على مزيد من الرعاية للمرضى الذين يعانون من مشاكل الكحول .
ar,"ومع ذلك , فان معظم السياح لا يتعرضون الا لمجموعة صغيرة من الاطباق التركية , ما لم يتم دعوتهم الى منزل تركي , او تناول الطعام في احد مطاعم البلاد الافضل ."
ar,"لقد كانت ثقيلة و واسعة , كلها مزورة من قطعة واحدة من الفولاذ ."
ar,لذيذ رغم اني احبها
ar,انهى الخباز طباعة المعلومات على بطاقة الطلب الخاصة واغلق الملف .
ar,واحد سقط ميتا على الفور ولكن الاخر تارجح بقوة .
ar,نحن دافعو الضرائب يستخدمون جيش من المحامين والاقتصاديين الذين يقضون كل لحظة استيقاظهم -- وربما القليل في ارض الاحلام -- يفكرون في طرق للحصول على مايكروسوفت .
ar,وفي كثير من الاحيان يجب على المستاجرين ان خذ مشاكلهم امام المحكمة قبل ان يضطر اصحاب الاراضي الى اجراء تغييرات .
ur,میرا خیال ہے کہ میں ایک سو سے ہزار سال پہلے تک پہنچ چکا ہوں جب میں نے اسے فروخت کر دیا تھا
ur,گو کہ شمارندی برنامج ( program ) کے بارے میں اختلاف کرنے لگے ، اس مقصد کے تنوع کا مطلب ہے کہ شمارندے میں ایک تنوع کی ضرورت نہیں ہے ، جس کی وجہ یہ ہے کہ شمارندے میں پروگرام کو نجی طور پر استعمال کیا جاتا ہے ۔ ایک سرکاری پیغام ۔
ur,بیلجیئن جاسوس جو یہ کام کر رہے تھے اس کے لئے تیار ہے .
ur,اوہ آپ کے ٹیریا میں ایک اچھا کھانا ہے .
ur,جی ہاں ، آپ کو سب سے پہلے اس کے بارے میں بتانے میں کامیاب ہو رہی ہے .
ur,اوہ ، ان کے پاس کوئی بھی ہے جو ملک پر کوئی بھی دیکھ سکتا ہے ۔
ur,لہذا یہ ایک دلچسپ خیال ہے کہ میں نے استعمال کیا ہے
ur,اور اگلی دفعہ ہم نے اس بات کو یقین کرنے کے لیے کہا ہے کہ تمام خواتین نے اس وقت کی تمام خواتین کو حاصل کیا ہے ، جو کہ آپ کی بادشاہی میں ہے ۔
nl,Hamas gemengde seksscholen verbod wordt van kracht
nl,"Laatste anti-moslim geweld in Birma Doodt 1, Wond 10"
nl,Minstens 20 doden in Somalië aanvallen
nl,Het commerciële gebruik van de 2.6.0 kernel is voor de meeste klanten echter nog maanden weg.
nl,Een man spoelt een biefstuk.
nl,Een vliegtuig dat op afstand vliegt.
nl,Australische premier Kevin Rudd roept de verkiezingen op voor 7 september.
nl,De mannen spelen cricket.
vi,"Phu nhân tadminster , vợ của thành viên của chúng ta , cô ấy là con gái của chúa tể abbotsbury , cũng như vậy ."
vi,Tôi đến từ một ngôi làng gia đình nghèo khổ về phía nam .
vi,Trại lao động của người nhập cư ôi chúa ơi họ sống trong hộp bìa
vi,Phụ lục một cho báo cáo và đặt hàng danh sách những người bình luận .
vi,"Chỉ với hai con đường để nói về , hầu hết đi du lịch là bằng chân lên và xuống cầu thang vô tận ."
vi,Nhưng tương lai lâu dài của Disney có vẻ như được đảm bảo như thế của coke hoặc điện chung .
vi,Người phụ nữ chiến binh đã quay lại và nhìn đi .
vi,"Không có gì nói về sự lãng mạn và các cô gái ấn độ , nhưng dave đã tự lấp đầy điều đó ."
bg,"огъване винаги се случва между дейностите -- ние сме свикнали да лекуваме това време между дейностите като буфер , по време на който са разгледани няколко малки задачи , а несигурността се пази от тях ."
bg,"много конкурентна , дори не знам много пари , които сестра ми е похарчила за нейната , но аз просто си помислих , че ще бъде загуба , тя няма да го направи , няма да го използва ."
bg,ти си голям идиот ! тя каза .
bg,"всичко , което липсва ..."
bg,"и ти просто избираш къмпинг на реката , ако знаеш над градуса , че си минал през дигата и си скочил във водата ."
bg,"нямаме контрол над качеството , безопасността или законността на на артикули , истината или точността на списъците , способността на продавачите да продават предмети или способността на купувачите да купуват предмети , посочва той ."
bg,"да , ти също. чао , чао ."
bg,брегът тук е необитаем .
fr,"Merci pour la livraison en temps et en heure comme d'habitude, j'ai pu remplacer mes vieilles mousses toutes usées, les nouvelles sont vraiment très confortables."
fr,"Belle finition, aucun problème à signaler. Penser à le regonfler tous les jours pour assurer la tension des surfaces."
fr,j'avais commandé un chargeur pour Nokia mais j'ai reçu un systéme pour écouter et pas pour recharger la batterie. Veuillez me rembourser les frais de retour
fr,"J'ai acheté cette console car c'était une des moins chère pour ce modèle . Toutefois je n'ai jamais été livré , j'ai donc parlé avec le SAV de Amazon , et finalement j'ai été remboursé même si j'ai attendu quelques semaines avant de voir cela possible."
fr,belle niche mais il ne faut pas que le chat soit trop gros !
fr,"impeccable, arrivé dans les temps Bravo"
fr,"Elle a tout d'une grande ! Offerte à une jeune fille qui n'en dit que du bien ! Elle la trouve superbe et encore mieux qu'en photo. Le réglage du bracelet est facile. A ce prix, c'est une belle surprise. A voir peut être dans le temps, mais pour l'instant parfaite !"
fr,plat / rien d'intéressant peu d'application concrète beaucoup de répétition / quand c'est technique très mal vulgarisé aucune information sur comment tendre ou pas les bandes peu d'exemple concret très déçu je recommande pas vous apprendrez rien.
ru,"Мангровые болота и раш кровати - это важная среда обитания для многих видов птиц и рыб , а также дом для небольшого населения ямайки крокодилов ."
ru,"Место может быть очень занятым , так что рано или поздно ."
ru,"Но лукас никогда не уточнил , почему убийство Фрэнк и его последствия были столь же ключевыми , как и его подзаголовок ."
ru,"Правый поворот на перекрестке ведет вдоль этажа долины мимо современных artisan деревень шейха Абд Эль-gurnah , где вы сможете купить алебастр и оникс части ."
ru,"На полях мы , врачи , обнаружили , что нас просят делать вещи , от которых нас тошнит ."
ru,"Все , чего не хватает ..."
ru,"Мало того , что он накопленного на них ."
ru,От Ватерлоо Борис Взял трубку до пикадилли цирка .
ja,結構短期間で赤いランプがついて使えなくなりました。しかし、説明書に日本語がなくどうしようもありませんでした。
ja,機能も充実しており、お値打ち感が半端ないです。とても満足です。
ja,購入してまだ2週間です。 たま~に、なぜか音が出なくなる。テレビ番組やDVD再生なとで、突然音が聞こえなくなり、電源をOFF/ONすると音がでるようになります。 あまり再現性もない。もうしばく様子をみようか、どうしようか。
ja,現在父が入院中で余命が長くないという状況です。遺産を兄弟で分けることにはなるだろうなと思っていましたが、兄弟はそのことには一切触れませんので心配していましたが口に出せずに困っていました。それでいざをいうときにどうしたら良いのか、こういうことはやはり弁護士さんとかにお願いしたらよいのかと漠然と思っておりました。そんなとき驚くことにこの本が目に入ってすぐに入手いたしました。何もかもがまったく知らないことばかりでこういうことを知らなければきっとこの著者が言うとおりに言われるままになっていたでしょう。本当にありがとうございました。心より感謝いたします。
ja,メーカーがホームページ上で公開しているPDFのパンフレットを見るとアルミ板は1㎜迄対応可能とありました。 1㎜厚のアルミ板を切断しました。 切断はできましたがありえないほどつらかったです。 1度切るごとに2㎝前後進むのですが、 両手で思い切り力を入れないと切れず、 切り終わるころには手がありえないほど痛く、 1日しても手がおかしいです。 私は男で力は強い方です。 また2㎝幅で1.5mほど切断しましたが上下にも左右にも曲がって使い物になりませんでした。 写真は頑張って真っ直ぐになるようにしたのですが、それでも曲がっています。 ありえません。。。
ja,気泡が入りやすく、硬化してもネバネバ感が取れない
ja,自宅で並べて使うには大きいのですが、3コースあって喜んで遊んでいるようです。
ja,結構いけますね。 細かい擦れ傷なんかはきれいに消える。 でも気をつけないとポリッシュでないところもピカピカになっちゃう。
en,Satisfied with overall product and timely shipping/packaging. Price was a bit high
en,Liked the product. But when I received product it was marked $4 less than what I paid. I called the sender and they would NOT budge on the price. Personally I though that was kind of Crappy! wont order from anything from them again for that reason.
en,"I enjoyed the form function of my new Samsung Note 9 so much that I refused to get a protective case. However, that phone is so slippery that I had dropped it about a dozen times. Well, the shocks finally took their toll when my Samsung gave up the ghost. Thankfully, I had purchased protection from Asurion at the Verizon store. This zeal for enjoying the form function of my new Samsung cost me a $199 deductible. I got my new phone but now determined not to throw away another $200 bucks, I researched the market for a suitable protective cover. Enter Zizo and their line of protective covers. I found the color scheme that best suited me and within a couple of days it was on my phone providing me with the protection in need. Gone is the slippery form function I enjoyed. I now have a rugged textured protective case. The case came along with the cover the front glass, too. That cover has an alligator clip for your jeans pocket so you just hang it there for a while. One annoying issue - there is a piece of plastic on the back of the case that can open up and act like a stand. Unfortunately, it ONLY operates in landscape mode. Nice for videos but totally inoperable for portrait while reading. All in all, the Zizo case is one heck of a rugged product. My son bought one for his phone, too. The apple does not fall from the tree as drops his phones, too. But he is a tad wiser than me because he's never been without a case for his Samsung phones. Two years now with dozens of dropped instances and his phone still rocks. Good case Zizo !"
en,"The box came banged up but the spray itself is fine. I haven’t tried the taste yet, but I was pleased to see the spray nozzle is protected by a plastic peice you can take off and on."
en,Best movie I have seen in a long time. It is a life changing movie!
en,"I was hopeful... I have used aftermarket inks in my printer with mixed results. The Black cartridge was the worse I have seen by far. Very dull and faded. Has now started to clog my printer nozzle. As I mentioned, I have used lots of aftermarket ink and could deal with faded blacks but the clogged nozzle is a deal breaker. You should definitely look elsewhere for ink!"
en,"Love this game! USPS nearly destroyed it, box was mangled so bad. But plastic parts seemed durable I guess. Cheap China made. Tons of fun for family."
en,"This book is an absolute dream! The pictures are stunning and so beautifully created. I felt so inspired reading not only the recipes but the lovely stories in the pages of this book. It offers so much more than recipes and tips on foraging, it offers excitment, wonder and intrigue to those looking to be inspired by nature. To anyone concerned with the the tips on consuming raw ingredients, I would say do your own research! What works for someone may not work for others. Listen to your body! The author offers what works and is loved by her and her family. I have consumed many raw ingredients from nature and am perfectly fine. This book is a must!"
el,"Ναι , ανυπομονώ για ένα πολύ άσχημο καλοκαίρι και ζεστό καλοκαίρι ."
el,Η μόνιμη ενίσχυση του ρυθμού αύξησης του ΑΕΠ θα απαιτούσε διαρκώς αυξανόμενες σχετικές μετοχές της αποταμίευσης και
el,"Μέχρι να βρω τον τελευταίο κρίκο στην αλυσίδα μου , πρέπει να παραμείνω πίσω από τις σκηνές ."
el,Ο Καθηγητής Ρότζερς κέρδισε πτυχίο καλών τεχνών από το πανεπιστήμιο του κάνσας και έναν γιατρό από τη Νομική Σχολή του γέιλ .
el,"Το περιοδικό αύξησε ανάλογα τις τιμές των διαφημίσεων , τιμολόγησης ιδιότροπη διαφημιστές από το περιοδικό υπέρ των μεγάλων εθνικών ."
el,"Ο πληθυσμός των ηλικιωμένων των ΗΠΑ , ηλικίας 65 ετών και άνω , αυξάνεται και αντιπροσωπεύει αυξανόμενο μερίδιο του συνολικού πληθυσμού ( βλέπε σχήμα 1.6 ) ."
el,"Ναι , ανυπομονώ για ένα πολύ άσχημο καλοκαίρι και ζεστό καλοκαίρι ."
el,"Ομοίως , η αεροπορική μεταφορά παρέχεται με σύμβαση , και ένα κέντρο διαλογής για το express mail λειτουργεί με σύμβαση ."
es,"No me ha gustado. No me parece práctico, se sujetan mal ... Tiene el diseño de una percha. Me parece que la oreja de un cliente es algo mas que un sitio donde colgar cosas. No lo recomiendo en absoluto. Guardados en un cajón."
es,Unicamente llega un muñeco en lugar de 18 tal y como indica. Devuelto inmediatamente. 16€ por un muñeco es una locura.
es,Coincide totalmente con la descripción
es,"no me han llegado, pero pone que me las han entregado y si me las han cobrado, he hecho una devolución para poder contactar con ellos y nadie me dice nada"
es,"Buena calidad, aunque el primero que me enviaron no funcionaba. Pero la solución fue satisfactoria. Por ahora funciona correctamente. GOOD."
es,"Todo perfecto,tal y como se esperaba"
es,Muy práctico! Lo usamos siempre para pasear con nuestra mascota!
es,"Los guantes están bien, pero el tallaje es un poco grande, pero las protecciones para nudillos son correctas. El cierre es un poco pobre pero para el precio están bien"
tr,"Evet , ben de gidip o kadar korkunç göründüğünü görmeye korkuyorum ki , belki de önümüzdeki altı ay boyunca kabus görüyordum ."
tr,"Bu ışıkta , küresel siyasetin multicivilizational karakterini korumak için yaptığı çağrı , ayrı ama eşit görünüyor ."
tr,"Neden , rahatsız , yorgun ve hatta biraz hasta olduklarını , ama ciddi şekilde zarar , ve gençlerin onlara iyi davrandığı için ."
tr,"Burada küçük bir arka plan var ama bu konu bizim kilise ' nin uzun uzun bir tartışma grubu olduğunu ve temel olarak , Hindistan ' da açlıktan ölen insanların olduğu o zamanda ,"
tr,"Huzurlu ama güçlü Katolik Derneği ' ni kurdu ve 1829 ' de wellington dükü , bir iç savaştan kaçınmak için , irlanda katolikler ilk kez Westminster ' da mecliste otur izin veren Katolik özgürlük tasarısını geçti ."
tr,"Mercaderes ve obispo köşesinde yakın zamanda yenilenmiş , 1920 s-ERA HOTEL AMBULANS MUNDOS ; Hemingway , 1930 ' larda bir kaç yıl boyunca 511 numaralı odada yaşadı ."
tr,"Hava kalitesi modelleme sonuçları , sağlık sonuçlarına göre hava kalitesi değişikliklerini tercüme eden bir modelleme sistemine giriş olarak hizmet veriyor ( ör ."
tr,"Mısır ( 6712 Hollywood Bulvarı ) , 1922 yılında Kral Tut ' un mezarının keşif sonra graumann tarafından inşa edilen Hollywood ' un ilk film sarayı ."
pl,Rozmowy pokojowe z Palestyńczykami trwałyby miesiącami: urzędnik izraelski
pl,Pokój z kilkoma monitorami komputerowymi.
pl,NATO: 5 Amerykanów zabitych w południowym Afganistanie
pl,"Ale ja wolałbym mówić o wysokich standardach niż o niskich."""
pl,Egipskie Bractwo stoi na ziemi po zabójstwach.
pl,"Chiny, Indie przysięgają na dalsze więzi dwustronne"
pl,Libijczycy zaczynają oddawać broń
pl,Mężczyzna w niebieskiej czapce siedzi na stołku pod drzewem.
hi,"गुणवत ् ता-ए-जीवन ड ् रग ् स का प ् रस ् ताव सिर ् फ खुश होने की संभावना नहीं है कि आप नपुंसकता , गंजेपन , काली चिरोपॉडिस ् टस के बारे में कुछ कर सकते हैं ."
hi,यह सपना आदिम कला की तस ् बीह करती है जो इस तरह की फिल ् म का दृश ् य है जो वास ् तव में धार ् मिक लगता है .
hi,कम से कम पहले के रूप में .
hi,मुझे लगता है कि वह शायद उन पर बहुत असर था और वे शायद ऐसा कभी नहीं किया होगा कि अगर यह जुनून के अपराध के अपराध के लिए नहीं था
hi,और और अगले हाँ पॉइंट सात पांच लीटर और फिर लीटर ् स और फिर एक बिंदु सात पांच लीटर हाँ
hi,हाँ यह मजेदार है कि एक पूरा अलग खेल है
hi,एक मिनट प ् रतीक ् षा करें हमें बहुत अधिक भुगतान नहीं करते हैं और वे अपना बैलेंस छोड ़ देते हैं उह वे आपका मासिक भुगतान कम कर देते हैं क ् योंकि वे चाहते हैं कि रुचि बनाने के लिए रुचि है
hi,अच ् छी तरह से मुझे पता है कि मैं हमेशा एक नई कार खरीदने का सपना रखता हूँ लेकिन हाँ मैं यह नहीं करता कि सिर ् फ पैसा सिर ् फ यही है कि उस shininess के लायक नहीं है
th,บอก เลย ว่า มัน ไม่ใช่ อย่าง ที่ คุณ มโน
