label,text
th,ชื่อ ที่ ถูกต้อง เพิ่มเติม สำหรับ อาคาร ของ อาคาร คือ เคิร์ก สูง ของ   edinburgh
th,"ที่ ร้าน ถนน หน้า ยุ่ง ใน ฟิลลิป ส ์ คุณ สามารถ ซื้อ เด ลฟ์ ท ์ บลู ,   อัญมณี ,   ผ้า ลินิน ไทย ,   ผ้า ลินิน ,   กระจก เปรู ,   เงิน เก่า ,   และ เหล้า"
th,Santorini   และ   patagonia   โดยเฉพาะอย่างยิ่ง มี เสื้อผ้า แบรนด์ เนม และ รองเท้า จาก ยุโรป และ สหรัฐอเมริกา
th,"Satheri   ชอบ ที่จะ ได้รับ พวง ใหญ่ ผ่าน ใน   conjuration   เดียว เช่น การลาก ที่ พวกเขา ทำ จาก เหยื่อ ของ คน ที่ ชื่อ   tamerlane   ""   เขา ทดสอบ เชือก แล้ว ลดลง ไป นั่ง ตำแหน่ง นั่ง บน ขอบ บล็อค"
th,เธอ มี กริช ของ หิน อ็ อบ ซิ เดีย น
th,"เคย แข่ง กับ โคล ท ์ ของ คุณ ไหม ?   ""   """
th,การปะทะ กัน อย่างต่อเนื่อง ระหว่าง ค่านิยม ที่ ทันสมัย และ ดั้งเดิม นำไปสู่ ความขัดแย้ง ที่ น่าหลงใหล มากมาย ที่ คุณ จะ พบ ใน ญี่ปุ่น
